{"assertedInventoryDigest":"sha256:09108810bd0ccf3bd56fbf792192c4c70d5215bc1ae29a59c25172601182100c","bindingBundleDigest":"sha256:8184f15f88479ce25d32e1d91073c11a5b4bbdbfb63f6ce7464926d439c03630","canonicalPayloadDigest":"sha256:a1dabe17ff7da089929a332faf88e93d7a5f0a7b6b38ddfabcd657d75970f849","catalog":{"buildKey":"sha256:7bc07c1690f1014279979db7450875d42166de26f7bba480ce104dde78e9a284","inputInventoryDigest":"sha256:44e5a7e39d898cd271424a8e34033c791171abcb46ba1f868cf9b384d30771e3","inputs":[{"byteLength":1159,"path":"bindings/atlas/3.0/tests/registry-descriptors.json","role":"registryDescriptorProof","sha256":"sha256:b2ccb972ca424ed90268a04b8b96b76b8f0fc8c83e6e77573c8c20d397ca3533","sourceIri":"urn:ref:atlas:registry-descriptor-proof:3.0"},{"byteLength":307756,"path":"bindings/atlas/3.0/tests/registry-descriptors.nq","role":"registryDescriptors","sha256":"sha256:12e215f0f8d2c1eb770527c64d4e01fc233c7a09354259df1c2739f635196e8e","sourceIri":"urn:ref:atlas:registry-descriptors:3.0"}],"rdfPack":{"contentDigest":"sha256:6f0022859ba138950f01d0d1134faca825fd9adedfc57f94748c580ddeec09b6","packId":"urn:ref:atlas:pack:6f0022859ba138950f01d0d1134faca825fd9adedfc57f94748c580ddeec09b6","path":"packs/rdf/catalog.nq"},"releaseSchemeInventoryDigest":"sha256:16c525f7616870eedc5e1717564edb4dba637ccbbe79e8743e1c0ee615bf7626"},"compactPackCount":46,"compactPackInventoryDigest":"sha256:859f312c17a30c64512f690ef728bfd47a75eec69d01efe482bbfba616f49002","compactPacks":[{"content":{"byteLength":2745,"digest":"sha256:e3b8eb8dbc60edaaa461fb52f729babcde1f62f5ad1415232a3b4695f6fc6a0a","mediaType":"application/x-ndjson","recordCount":3},"defaults":{},"dependencies":["urn:ref:atlas:compact-pack:93fd36aaf499f4aebe1379ac263e54eb89802ef302eaaf98cc09ca706f8b2cff","urn:ref:atlas:compact-pack:c1cf82205a04c3422c2319b1cdf3c4f1b01f6e00699ba8820b5467fbfabecc70"],"globalInvariantSummary":{"digest":"sha256:724a825bbc8488435bd3e9b0ba4fd077fdaf5b02258df2e279b9facbdc8f28f1","fieldCounts":{"evidenceLinks":3,"identifierClaims":0,"labelClaims":0,"lifecycleEvents":0,"recordIds":3,"releaseRecords":0,"resourceOwnership":0,"sourceRecordLinks":0,"statementEndpoints":0},"recordCount":3,"recordRole":"EvidenceBinding","schemaVersion":"1.0"},"logicalRowsDigest":"sha256:8258dd6823cd34452a31e998380b042b3ff9b3fd9f418679a5ee3a5572f0713f","packId":"urn:ref:atlas:compact-pack:e3b8eb8dbc60edaaa461fb52f729babcde1f62f5ad1415232a3b4695f6fc6a0a","path":"packs/compact/source-entities/evidencebinding.jsonl.zst","recordSchemaVersion":"1.0","role":"EvidenceBinding","transport":{"byteLength":943,"compression":"zstd","digest":"sha256:5da1b59bd290246124db85e6da57de932872b9a02e30ec775b53c2947139bad8","mediaType":"application/zstd"}},{"content":{"byteLength":883,"digest":"sha256:631d6aa2e81e01169093c855bc885837528dd8c1ed4d8f66a056714dc8b75343","mediaType":"application/x-ndjson","recordCount":1},"defaults":{},"dependencies":["urn:ref:atlas:compact-pack:93fd36aaf499f4aebe1379ac263e54eb89802ef302eaaf98cc09ca706f8b2cff","urn:ref:atlas:compact-pack:ded30782d413e57015e7ad620f1a2fecae55692e7baaba9a6c3addeea4f854f7"],"globalInvariantSummary":{"digest":"sha256:c1fb97ed10445f9494448ecab4cbf59498256e2e5478b627c149055dd0ab4c54","fieldCounts":{"evidenceLinks":0,"identifierClaims":1,"labelClaims":0,"lifecycleEvents":0,"recordIds":1,"releaseRecords":0,"resourceOwnership":0,"sourceRecordLinks":0,"statementEndpoints":0},"recordCount":1,"recordRole":"Identifier","schemaVersion":"1.0"},"logicalRowsDigest":"sha256:bf3e5745112706023cbb78495e5577081583487c7cb61eccfd8eb4ea86123234","packId":"urn:ref:atlas:compact-pack:631d6aa2e81e01169093c855bc885837528dd8c1ed4d8f66a056714dc8b75343","path":"packs/compact/source-entities/identifier.jsonl.zst","recordSchemaVersion":"1.0","role":"Identifier","transport":{"byteLength":499,"compression":"zstd","digest":"sha256:c9718b74e7b23703eea85ab578640cb61161bda41cbaca91e968d2b15587d8d7","mediaType":"application/zstd"}},{"content":{"byteLength":1006,"digest":"sha256:aa9761160fbacc66b998f31da8938187ba729912a3154298c7f9d0d1d53f574c","mediaType":"application/x-ndjson","recordCount":1},"defaults":{},"dependencies":["urn:ref:atlas:compact-pack:2f9626a42a7c8e59103ab4ae18dc11266b1428736b25b46a9797bc8fd503577c","urn:ref:atlas:compact-pack:93fd36aaf499f4aebe1379ac263e54eb89802ef302eaaf98cc09ca706f8b2cff","urn:ref:atlas:compact-pack:ded30782d413e57015e7ad620f1a2fecae55692e7baaba9a6c3addeea4f854f7"],"globalInvariantSummary":{"digest":"sha256:33866f2011369276cb0986c6621688d0c3e36d9d1cdda5ec830f3569d8f11dc6","fieldCounts":{"evidenceLinks":0,"identifierClaims":0,"labelClaims":1,"lifecycleEvents":0,"recordIds":1,"releaseRecords":0,"resourceOwnership":0,"sourceRecordLinks":0,"statementEndpoints":0},"recordCount":1,"recordRole":"Label","schemaVersion":"1.0"},"logicalRowsDigest":"sha256:46e88282cef52623144a64cfdb6728ba2e72e5f0e0278323a007a1f1d23f9f7c","packId":"urn:ref:atlas:compact-pack:aa9761160fbacc66b998f31da8938187ba729912a3154298c7f9d0d1d53f574c","path":"packs/compact/source-entities/label.jsonl.zst","recordSchemaVersion":"1.0","role":"Label","transport":{"byteLength":563,"compression":"zstd","digest":"sha256:6ae9c8534bb8725c0a7aff9338e7ab5e7e01ed4c2dc45be5c15483f9e3bf3668","mediaType":"application/zstd"}},{"content":{"byteLength":1199,"digest":"sha256:2f9626a42a7c8e59103ab4ae18dc11266b1428736b25b46a9797bc8fd503577c","mediaType":"application/x-ndjson","recordCount":2},"defaults":{},"dependencies":[],"globalInvariantSummary":{"digest":"sha256:ee71786b36fd29aa22cef7f5fbbf5f3b12dabdb5ce1737fdd596942979307949","fieldCounts":{"evidenceLinks":0,"identifierClaims":0,"labelClaims":0,"lifecycleEvents":0,"recordIds":2,"releaseRecords":2,"resourceOwnership":0,"sourceRecordLinks":0,"statementEndpoints":0},"recordCount":2,"recordRole":"Release","schemaVersion":"1.0"},"logicalRowsDigest":"sha256:2b7498e103984f3283803cd391435eb8608c7e5f6313f1ab1d6047840bbe2fa2","packId":"urn:ref:atlas:compact-pack:2f9626a42a7c8e59103ab4ae18dc11266b1428736b25b46a9797bc8fd503577c","path":"packs/compact/source-entities/release.jsonl.zst","recordSchemaVersion":"1.0","role":"Release","transport":{"byteLength":610,"compression":"zstd","digest":"sha256:0d7fc2551fc428ee460497de00b7c947cfbc117bb518d28593076c60fcd40d59","mediaType":"application/zstd"}},{"content":{"byteLength":902,"digest":"sha256:ded30782d413e57015e7ad620f1a2fecae55692e7baaba9a6c3addeea4f854f7","mediaType":"application/x-ndjson","recordCount":1},"defaults":{},"dependencies":["urn:ref:atlas:compact-pack:2f9626a42a7c8e59103ab4ae18dc11266b1428736b25b46a9797bc8fd503577c","urn:ref:atlas:compact-pack:93fd36aaf499f4aebe1379ac263e54eb89802ef302eaaf98cc09ca706f8b2cff"],"globalInvariantSummary":{"digest":"sha256:5ab91fb6053d9152258ab74bacf7f0152f03644f94fcc6fbd82deb95de8f827f","fieldCounts":{"evidenceLinks":0,"identifierClaims":0,"labelClaims":0,"lifecycleEvents":0,"recordIds":1,"releaseRecords":0,"resourceOwnership":1,"sourceRecordLinks":0,"statementEndpoints":0},"recordCount":1,"recordRole":"Resource","schemaVersion":"1.0"},"logicalRowsDigest":"sha256:193d0abace02a58d6545849a2b726b8b616ad9bd05ed55cd49c457aff9cbbd25","packId":"urn:ref:atlas:compact-pack:ded30782d413e57015e7ad620f1a2fecae55692e7baaba9a6c3addeea4f854f7","path":"packs/compact/source-entities/resource.jsonl.zst","recordSchemaVersion":"1.0","role":"Resource","transport":{"byteLength":512,"compression":"zstd","digest":"sha256:601b532f0e8e481aa75fa8e81e2c61dc2b3b43d4aae9d36b5cc4e0cd95f5eebc","mediaType":"application/zstd"}},{"content":{"byteLength":851,"digest":"sha256:93fd36aaf499f4aebe1379ac263e54eb89802ef302eaaf98cc09ca706f8b2cff","mediaType":"application/x-ndjson","recordCount":1},"defaults":{},"dependencies":[],"globalInvariantSummary":{"digest":"sha256:3d54c285bc8bf446a267712312909ea1a0686b7aa13bb4b150ad8bf701c43f5b","fieldCounts":{"evidenceLinks":0,"identifierClaims":0,"labelClaims":0,"lifecycleEvents":0,"recordIds":1,"releaseRecords":0,"resourceOwnership":0,"sourceRecordLinks":1,"statementEndpoints":0},"recordCount":1,"recordRole":"SourceRecord","schemaVersion":"1.0"},"logicalRowsDigest":"sha256:f8fc5dbafefdf97d5beb65f657bf18afb8a66bc9ea375dcad56dc38825603337","packId":"urn:ref:atlas:compact-pack:93fd36aaf499f4aebe1379ac263e54eb89802ef302eaaf98cc09ca706f8b2cff","path":"packs/compact/source-entities/sourcerecord.jsonl.zst","recordSchemaVersion":"1.0","role":"SourceRecord","transport":{"byteLength":484,"compression":"zstd","digest":"sha256:96115247223631d4159597756f29c74396536a44e74259cda4b5d9344b634253","mediaType":"application/zstd"}},{"content":{"byteLength":3721,"digest":"sha256:c1cf82205a04c3422c2319b1cdf3c4f1b01f6e00699ba8820b5467fbfabecc70","mediaType":"application/x-ndjson","recordCount":3},"defaults":{},"dependencies":["urn:ref:atlas:compact-pack:0e000a769bfb51911f96c0ed0cc343eb2a06ca80f1ac68cdeeea2cccd71c0d55","urn:ref:atlas:compact-pack:2f9626a42a7c8e59103ab4ae18dc11266b1428736b25b46a9797bc8fd503577c","urn:ref:atlas:compact-pack:6131058c47b409765d51d0a8a3d76af6d1fb21a4f50e256539b957de46d94ba3","urn:ref:atlas:compact-pack:93fd36aaf499f4aebe1379ac263e54eb89802ef302eaaf98cc09ca706f8b2cff","urn:ref:atlas:compact-pack:daf4fcb509c8f60d9d1bbb73bfcddf983fe2d678ff362c3b2c15e591b0d3d01e","urn:ref:atlas:compact-pack:ded30782d413e57015e7ad620f1a2fecae55692e7baaba9a6c3addeea4f854f7","urn:ref:atlas:compact-pack:f286aa337600b66e268c36b211d234ecfe8f389558e05fd750d4ee23c58d053e"],"globalInvariantSummary":{"digest":"sha256:752a6494e31856a02b8a40271d90a525a49700eafd9bd76e2d3f5fd79c76b206","fieldCounts":{"evidenceLinks":0,"identifierClaims":0,"labelClaims":0,"lifecycleEvents":0,"recordIds":3,"releaseRecords":0,"resourceOwnership":0,"sourceRecordLinks":0,"statementEndpoints":3},"recordCount":3,"recordRole":"Statement","schemaVersion":"1.0"},"logicalRowsDigest":"sha256:5b8e05809d12980fc20ebaf3b22e5bfa1fc085dccf2962093a94006f47f02a92","packId":"urn:ref:atlas:compact-pack:c1cf82205a04c3422c2319b1cdf3c4f1b01f6e00699ba8820b5467fbfabecc70","path":"packs/compact/source-entities/statement.jsonl.zst","recordSchemaVersio